<!ELEMENT CategorieSpoiler (CategoriaSpoiler+)>
<!ELEMENT CategoriaSpoiler (nome+, utenteCreatore*, dataInserimento*)>
<!ELEMENT nome (#PCDATA)>
<!ELEMENT utenteCreatore (#PCDATA)>
<!ELEMENT dataInserimento (#PCDATA)>
